{
  "schema_version": 2,
  "timezone": "America/Sao_Paulo",
  "updated_at": "2026-10-07T11:47:29.031783+00:00",
  "coverage_start": "2026-10-12",
  "coverage_end": "2026-10-25",
  "economic_coverage": [],
  "polls": {
    "status": "pending",
    "coverage_start": "2026-10-15",
    "coverage_end": "2026-10-25",
    "checked_at": "2026-10-15T11:25:16.324874+00:00",
    "source_generated_at": "2026-10-14T05:47:34-03:00",
    "active_until": "2026-10-25",
    "first_round": "2026-10-04",
    "runoff_conditional": false,
    "election_source_url": "https://www.tse.jus.br/comunicacao/radio/2026/Outubro/brasil-voltara-as-urnas-em-25-de-outubro",
    "date_meaning": "permitted_release_not_confirmed_publication",
    "unknown_time": true,
    "unresolved_count": 1
  },
  "events": [
    {
      "id": "official:boe:sarah-breeden-sarah-breeden-interview-with-atlantic-council-on-digita:2026-10-12",
      "kind": "economic",
      "title": "Sarah Breeden: Interview with Atlantic Council on digital assets, tokenization and upcoming G20 presidency",
      "country": "Reino Unido",
      "currency": "GBP",
      "starts_at": "2026-10-12T10:30:00+01:00",
      "date": "2026-10-12",
      "time_status": "exact",
      "importance": "medium",
      "source_url": "https://www.bankofengland.co.uk/events/upcoming-events"
    },
    {
      "id": "official:boe:megan-greene-megan-greene-speech-at-atlantic-council-at-imf-world-ba:2026-10-13",
      "kind": "economic",
      "title": "Megan Greene: Speech at Atlantic Council at IMF World Bank Meetings, Bangkok",
      "country": "Reino Unido",
      "currency": "GBP",
      "starts_at": "2026-10-13T04:00:00+01:00",
      "date": "2026-10-13",
      "time_status": "exact",
      "importance": "medium",
      "source_url": "https://www.bankofengland.co.uk/events/upcoming-events"
    },
    {
      "id": "official:us.fed_speech.d9e9fad99795.2026-10-13",
      "kind": "economic",
      "title": "Discussion - Governor Christopher J. Waller AI At the Bloomberg New Economy Forum 2026, New Delhi, India",
      "country": "EUA",
      "currency": "USD",
      "starts_at": "2026-10-13T07:45:00+00:00",
      "date": "2026-10-13",
      "time_status": "exact",
      "importance": "medium",
      "source_url": "https://www.federalreserve.gov/newsevents/2026-october.htm"
    },
    {
      "id": "official:bcb:focus:agendaics440relatoriofocus",
      "kind": "economic",
      "title": "Relatório Focus",
      "country": "Brasil",
      "currency": "BRL",
      "starts_at": "2026-10-13T08:30:00-03:00",
      "date": "2026-10-13",
      "time_status": "exact",
      "importance": "low",
      "source_url": "https://www.bcb.gov.br/api/exportarics/sitebcb/agendaics?lista=Focus"
    },
    {
      "id": "official:ecb:participation-by-mr-elderson-in-a-panel-1-the-clean-industrial-deal-and-a-european-growth-strategy-a:2026-10-13",
      "kind": "economic",
      "title": "ECB Frank Elderson: Participation by Mr Elderson in a Panel 1 \"The Clean Industrial Deal and a European growth strategy\" at Friends of Europe Energy and Climate Summit in Brussels, Belgium",
      "country": "Eurozona",
      "currency": "EUR",
      "starts_at": "2026-10-13T09:15:00+02:00",
      "date": "2026-10-13",
      "time_status": "exact",
      "importance": "medium",
      "source_url": "https://www.ecb.europa.eu/press/calendars/weekly/html/index.en.html"
    },
    {
      "id": "official:fgv:ipc-3i-3o-tri:2026-10-13",
      "kind": "economic",
      "title": "IPC-3i 3º tri",
      "country": "Brasil",
      "currency": "BRL",
      "starts_at": "2026-10-13T11:00:00-03:00",
      "date": "2026-10-13",
      "time_status": "exact",
      "importance": "low",
      "source_url": "https://portalibre.fgv.br/sites/default/files/users/user2873/calendario-2026-2027_portal-da-inflacao_vf.pdf"
    },
    {
      "id": "official:us.adp_weekly.2026-10-13",
      "kind": "economic",
      "title": "ADP National Employment Report Weekly NER Pulse",
      "country": "EUA",
      "currency": "USD",
      "starts_at": "2026-10-13T12:15:00+00:00",
      "date": "2026-10-13",
      "time_status": "exact",
      "importance": "medium",
      "source_url": "https://adpemploymentreport.com/ner_production.json"
    },
    {
      "id": "official:us.existing_home_sales.2026-10-13",
      "kind": "economic",
      "title": "September Existing-Home Sales",
      "country": "EUA",
      "currency": "USD",
      "starts_at": "2026-10-13T14:00:00+00:00",
      "date": "2026-10-13",
      "time_status": "exact",
      "importance": "medium",
      "source_url": "https://www.nar.realtor/press-releases/nar-statistical-news-release-schedule"
    },
    {
      "id": "official:ecb:speech-by-mr-lane-at-pre-summit-dinner-hosted-by-micheal-martin-prime-minister-of-ireland-ahead-of-i:2026-10-13",
      "kind": "economic",
      "title": "ECB Philip R. Lane: Speech by Mr Lane at pre-Summit dinner hosted by Micheál Martin, Prime Minister of Ireland ahead of International AI Summit in Dublin, Ireland",
      "country": "Eurozona",
      "currency": "EUR",
      "starts_at": "2026-10-13T20:30:00+02:00",
      "date": "2026-10-13",
      "time_status": "exact",
      "importance": "medium",
      "source_url": "https://www.ecb.europa.eu/press/calendars/weekly/html/index.en.html"
    },
    {
      "id": "official:ecb:participation-by-ms-lagarde-in-on-stage-conversation-with-richard-quest-leadership-in-an-age-of-chan:2026-10-14",
      "kind": "economic",
      "title": "ECB Christine Lagarde: Participation by Ms Lagarde in on-stage conversation with Richard Quest \"Leadership in an age of change\" at CNN Global Perspectives event in Bangkok, Thailand",
      "country": "Eurozona",
      "currency": "EUR",
      "starts_at": "2026-10-14T04:10:00+02:00",
      "date": "2026-10-13",
      "time_status": "exact",
      "importance": "medium",
      "source_url": "https://www.ecb.europa.eu/press/calendars/weekly/html/index.en.html"
    },
    {
      "id": "official:boe:huw-pill-huw-pill-citi-roundtable-at-imf-bangkok:2026-10-14",
      "kind": "economic",
      "title": "Huw Pill: Citi Roundtable at IMF, Bangkok",
      "country": "Reino Unido",
      "currency": "GBP",
      "starts_at": "2026-10-14T07:00:00+01:00",
      "date": "2026-10-14",
      "time_status": "exact",
      "importance": "medium",
      "source_url": "https://www.bankofengland.co.uk/events/upcoming-events"
    },
    {
      "id": "official:ibge:4311",
      "kind": "economic",
      "title": "Pesquisa Mensal de Serviços",
      "country": "Brasil",
      "currency": "BRL",
      "starts_at": "2026-10-14T09:00:00-03:00",
      "date": "2026-10-14",
      "time_status": "exact",
      "importance": "low",
      "source_url": "https://servicodados.ibge.gov.br/api/v3/calendario/?qtd=500&de=2026-10-12&ate=2026-10-25"
    },
    {
      "id": "official:us.fed_speech.b1333c9eda18.2026-10-14",
      "kind": "economic",
      "title": "Discussion - Vice Chair for Supervision Michelle W. Bowman Supervision and Regulation At the 2026 IIF Annual Membership Summit, Bangkok, Thailand",
      "country": "EUA",
      "currency": "USD",
      "starts_at": "2026-10-14T09:40:00+00:00",
      "date": "2026-10-14",
      "time_status": "exact",
      "importance": "medium",
      "source_url": "https://www.federalreserve.gov/newsevents/2026-october.htm"
    },
    {
      "id": "official:ecb:keynote-speech-by-mr-elderson-at-ecb-boe-conference-on-supervising-climate-risk-in-a-non-linear-worl:2026-10-14",
      "kind": "economic",
      "title": "ECB Frank Elderson: Keynote speech by Mr Elderson at ECB-BoE Conference on Supervising Climate Risk in a Non-Linear World in Frankfurt, Germany",
      "country": "Eurozona",
      "currency": "EUR",
      "starts_at": "2026-10-14T10:00:00+02:00",
      "date": "2026-10-14",
      "time_status": "exact",
      "importance": "medium",
      "source_url": "https://www.ecb.europa.eu/press/calendars/weekly/html/index.en.html"
    },
    {
      "id": "official:us.business_formation.2026-10-14",
      "kind": "economic",
      "title": "Business Formation Statistics",
      "country": "EUA",
      "currency": "USD",
      "starts_at": "2026-10-14T10:00:00-04:00",
      "date": "2026-10-14",
      "time_status": "exact",
      "importance": "medium",
      "source_url": "https://www.census.gov/economic-indicators/calendar-listview-2026.html"
    },
    {
      "id": "official:ecb:fireside-chat-by-claudia-buch-at-worlds-bank-knowledge-cafe-session-in-bangkok-thailand:2026-10-14",
      "kind": "economic",
      "title": "ECB Claudia Buch: Fireside chat by Claudia Buch at World’s Bank Knowledge Café session in Bangkok, Thailand",
      "country": "Eurozona",
      "currency": "EUR",
      "starts_at": "2026-10-14T10:15:00+02:00",
      "date": "2026-10-14",
      "time_status": "exact",
      "importance": "medium",
      "source_url": "https://www.ecb.europa.eu/press/calendars/weekly/html/index.en.html"
    },
    {
      "id": "official:ecb:participation-by-ms-lagarde-in-fireside-chat-with-josh-lipsky-organised-by-the-atlantic-council-in-b:2026-10-14",
      "kind": "economic",
      "title": "ECB Christine Lagarde: Participation by Ms Lagarde in fireside chat with Josh Lipsky organised by the Atlantic Council in Bangkok, Thailand",
      "country": "Eurozona",
      "currency": "EUR",
      "starts_at": "2026-10-14T10:30:00+02:00",
      "date": "2026-10-14",
      "time_status": "exact",
      "importance": "medium",
      "source_url": "https://www.ecb.europa.eu/press/calendars/weekly/html/index.en.html"
    },
    {
      "id": "official:us.cpi.61b9d567a7620134",
      "kind": "economic",
      "title": "Consumer Price Index",
      "country": "EUA",
      "currency": "USD",
      "starts_at": "2026-10-14T12:30:00+00:00",
      "date": "2026-10-14",
      "time_status": "exact",
      "importance": "high",
      "source_url": "https://www.bls.gov/schedule/news_release/bls.ics"